{
  "schema_version": "6.0",
  "source_schema_version": "5.0",
  "generated_at": "2026-10-14T05:46:47.236084+00:00",
  "engine": "P01-006",
  "rules_version": "1.0",
  "regime": "RISK_OFF",
  "score": -0.7706,
  "confidence": 0.58,
  "coverage": 0.6,
  "contradiction": false,
  "drivers": [
    {
      "metric_id": "US10Y",
      "direction": "RISK_OFF",
      "strength": "STRONG",
      "signal_id": "VERY_HIGH_YIELD",
      "confidence": 0.9,
      "weight": 1.8,
      "weighted_score": -1.62
    },
    {
      "metric_id": "DXY",
      "direction": "RISK_OFF",
      "strength": "MODERATE",
      "signal_id": "FIRM_DOLLAR",
      "confidence": 1.0,
      "weight": 1.0,
      "weighted_score": -1.0
    },
    {
      "metric_id": "VIX",
      "direction": "NEUTRAL",
      "strength": "WEAK",
      "signal_id": "NORMAL_VOLATILITY",
      "confidence": 1.0,
      "weight": 0.6,
      "weighted_score": 0.0
    }
  ],
  "supporting": [
    {
      "metric_id": "US10Y",
      "direction": "RISK_OFF",
      "strength": "STRONG",
      "signal_id": "VERY_HIGH_YIELD",
      "confidence": 0.9,
      "weight": 1.8,
      "weighted_score": -1.62
    },
    {
      "metric_id": "DXY",
      "direction": "RISK_OFF",
      "strength": "MODERATE",
      "signal_id": "FIRM_DOLLAR",
      "confidence": 1.0,
      "weight": 1.0,
      "weighted_score": -1.0
    }
  ],
  "contradicting": [],
  "excluded": [
    {
      "metric_id": "BTC",
      "direction": "UNKNOWN",
      "reason": "INSUFFICIENT_HISTORY"
    },
    {
      "metric_id": "ETH",
      "direction": "UNKNOWN",
      "reason": "INSUFFICIENT_HISTORY"
    }
  ],
  "summary": {
    "eligible_signals": 3,
    "excluded_signals": 2,
    "total_signals": 5,
    "eligible_weight": 3.4,
    "weighted_sum": -2.62
  },
  "semantics": {
    "regime": [
      "RISK_ON",
      "NEUTRAL",
      "RISK_OFF",
      "UNKNOWN"
    ],
    "score": "Deterministic cross-signal balance from -1 (risk-off) to +1 (risk-on); not outcome probability.",
    "confidence": "Evidence reliability for regime classification; not probability of a market outcome."
  }
}